[
  {
    "id": "a2a-001",
    "name": "Heracross",
    "set_code": "a2a",
    "set_name": "Triumphant Light",
    "pack": "Arceus",
    "release_date": "2025-02-28",
    "type": "Pokémon",
    "subtype": "Grass",
    "stage": "Basic",
    "evolves_from": null,
    "rarity": "◊◊",
    "pack_points": 70,
    "ex": false,
    "mega": false,
    "shiny": false,
    "special_tags": null,
    "art_style": null,
    "health": 100,
    "retreat": 2,
    "weakness": "Fire",
    "ability": {
      "exists": false,
      "name": null,
      "effect": null
    },
    "card_text": null,
    "attacks": {
      "1": {
        "cost": "GCC",
        "name": "Single-Horn Throw",
        "damage": 50,
        "effect": "Flip 2 coins. If both of them are heads, this attack does 70 more damage."
      },
      "2": {
        "cost": null,
        "name": null,
        "damage": null,
        "effect": null
      }
    },
    "points": 1,
    "deckBuilderNr": 425,
    "share_code": "AAEAEJoA",
    "artist": "Satoshi Shirai",
    "image": "https://raw.githubusercontent.com/chase-manning/pokemon-tcg-pocket-cards/refs/heads/main/images/webp/cards/a2a/001.webp",
    "image_png": "https://raw.githubusercontent.com/chase-manning/pokemon-tcg-pocket-cards/refs/heads/main/images/png/cards/a2a/001.png",
    "flavour_text": "It loves sweet nectar. To keep all the nectar to itself, it hurls rivals away with its prized horn.",
    "alternate_versions": [
      {
        "set_code": "a2a",
        "set_name": "Triumphant Light",
        "id": 1,
        "rarity": "◊◊"
      }
    ]
  },
  {
    "id": "a2a-002",
    "name": "Burmy",
    "set_code": "a2a",
    "set_name": "Triumphant Light",
    "pack": "Arceus",
    "release_date": "2025-02-28",
    "type": "Pokémon",
    "subtype": "Grass",
    "stage": "Basic",
    "evolves_from": null,
    "rarity": "◊",
    "pack_points": 35,
    "ex": false,
    "mega": false,
    "shiny": false,
    "special_tags": null,
    "art_style": null,
    "health": 50,
    "retreat": 1,
    "weakness": "Fire",
    "ability": {
      "exists": false,
      "name": null,
      "effect": null
    },
    "card_text": null,
    "attacks": {
      "1": {
        "cost": "G",
        "name": "Ram",
        "damage": 20,
        "effect": null
      },
      "2": {
        "cost": null,
        "name": null,
        "damage": null,
        "effect": null
      }
    },
    "points": 1,
    "deckBuilderNr": 426,
    "share_code": "AAEAEKQA",
    "artist": "miki kudo",
    "image": "https://raw.githubusercontent.com/chase-manning/pokemon-tcg-pocket-cards/refs/heads/main/images/webp/cards/a2a/002.webp",
    "image_png": "https://raw.githubusercontent.com/chase-manning/pokemon-tcg-pocket-cards/refs/heads/main/images/png/cards/a2a/002.png",
    "flavour_text": "To shelter itself from cold, wintry winds, it covers itself with a cloak made of twigs and leaves.",
    "alternate_versions": [
      {
        "set_code": "a2a",
        "set_name": "Triumphant Light",
        "id": 2,
        "rarity": "◊"
      }
    ]
  },
  {
    "id": "a2a-003",
    "name": "Mothim",
    "set_code": "a2a",
    "set_name": "Triumphant Light",
    "pack": "Arceus",
    "release_date": "2025-02-28",
    "type": "Pokémon",
    "subtype": "Grass",
    "stage": "Stage 1",
    "evolves_from": "Burmy",
    "rarity": "◊◊",
    "pack_points": 70,
    "ex": false,
    "mega": false,
    "shiny": false,
    "special_tags": null,
    "art_style": null,
    "health": 90,
    "retreat": 0,
    "weakness": "Lightning",
    "ability": {
      "exists": false,
      "name": null,
      "effect": null
    },
    "card_text": null,
    "attacks": {
      "1": {
        "cost": "CC",
        "name": "Gust",
        "damage": 50,
        "effect": null
      },
      "2": {
        "cost": null,
        "name": null,
        "damage": null,
        "effect": null
      }
    },
    "points": 1,
    "deckBuilderNr": 427,
    "share_code": "AAEAEK4A",
    "artist": "MAHOU",
    "image": "https://raw.githubusercontent.com/chase-manning/pokemon-tcg-pocket-cards/refs/heads/main/images/webp/cards/a2a/003.webp",
    "image_png": "https://raw.githubusercontent.com/chase-manning/pokemon-tcg-pocket-cards/refs/heads/main/images/png/cards/a2a/003.png",
    "flavour_text": "It loves the honey of flowers and steals honey collected by Combee.",
    "alternate_versions": [
      {
        "set_code": "a2a",
        "set_name": "Triumphant Light",
        "id": 3,
        "rarity": "◊◊"
      }
    ]
  },
  {
    "id": "a2a-004",
    "name": "Combee",
    "set_code": "a2a",
    "set_name": "Triumphant Light",
    "pack": "Arceus",
    "release_date": "2025-02-28",
    "type": "Pokémon",
    "subtype": "Grass",
    "stage": "Basic",
    "evolves_from": null,
    "rarity": "◊",
    "pack_points": 35,
    "ex": false,
    "mega": false,
    "shiny": false,
    "special_tags": null,
    "art_style": null,
    "health": 50,
    "retreat": 1,
    "weakness": "Fire",
    "ability": {
      "exists": false,
      "name": null,
      "effect": null
    },
    "card_text": null,
    "attacks": {
      "1": {
        "cost": "G",
        "name": "Bug Bite",
        "damage": 20,
        "effect": null
      },
      "2": {
        "cost": null,
        "name": null,
        "damage": null,
        "effect": null
      }
    },
    "points": 1,
    "deckBuilderNr": 428,
    "share_code": "AAEAELgA",
    "artist": "Akira Komayama",
    "image": "https://raw.githubusercontent.com/chase-manning/pokemon-tcg-pocket-cards/refs/heads/main/images/webp/cards/a2a/004.webp",
    "image_png": "https://raw.githubusercontent.com/chase-manning/pokemon-tcg-pocket-cards/refs/heads/main/images/png/cards/a2a/004.png",
    "flavour_text": "At night, Combee sleep in a group of about a hundred, packed closely together in a lump.",
    "alternate_versions": [
      {
        "set_code": "a2a",
        "set_name": "Triumphant Light",
        "id": 4,
        "rarity": "◊"
      }
    ]
  },
  {
    "id": "a2a-005",
    "name": "Vespiquen",
    "set_code": "a2a",
    "set_name": "Triumphant Light",
    "pack": "Arceus",
    "release_date": "2025-02-28",
    "type": "Pokémon",
    "subtype": "Grass",
    "stage": "Stage 1",
    "evolves_from": "Combee",
    "rarity": "◊◊",
    "pack_points": 70,
    "ex": false,
    "mega": false,
    "shiny": false,
    "special_tags": null,
    "art_style": null,
    "health": 100,
    "retreat": 2,
    "weakness": "Fire",
    "ability": {
      "exists": false,
      "name": null,
      "effect": null
    },
    "card_text": null,
    "attacks": {
      "1": {
        "cost": "GGG",
        "name": "Reckless Charge",
        "damage": 120,
        "effect": "This Pokémon also does 30 damage to itself."
      },
      "2": {
        "cost": null,
        "name": null,
        "damage": null,
        "effect": null
      }
    },
    "points": 1,
    "deckBuilderNr": 429,
    "share_code": "AAEAEMIA",
    "artist": "kawayoo",
    "image": "https://raw.githubusercontent.com/chase-manning/pokemon-tcg-pocket-cards/refs/heads/main/images/webp/cards/a2a/005.webp",
    "image_png": "https://raw.githubusercontent.com/chase-manning/pokemon-tcg-pocket-cards/refs/heads/main/images/png/cards/a2a/005.png",
    "flavour_text": "It houses its colony in cells in its body and releases various pheromones to make those grubs do its bidding.",
    "alternate_versions": [
      {
        "set_code": "a2a",
        "set_name": "Triumphant Light",
        "id": 5,
        "rarity": "◊◊"
      }
    ]
  },
  {
    "id": "a2a-006",
    "name": "Cherubi",
    "set_code": "a2a",
    "set_name": "Triumphant Light",
    "pack": "Arceus",
    "release_date": "2025-02-28",
    "type": "Pokémon",
    "subtype": "Grass",
    "stage": "Basic",
    "evolves_from": null,
    "rarity": "◊",
    "pack_points": 35,
    "ex": false,
    "mega": false,
    "shiny": false,
    "special_tags": null,
    "art_style": null,
    "health": 50,
    "retreat": 1,
    "weakness": "Fire",
    "ability": {
      "exists": false,
      "name": null,
      "effect": null
    },
    "card_text": null,
    "attacks": {
      "1": {
        "cost": "G",
        "name": "Leafage",
        "damage": 20,
        "effect": null
      },
      "2": {
        "cost": null,
        "name": null,
        "damage": null,
        "effect": null
      }
    },
    "points": 1,
    "deckBuilderNr": 430,
    "share_code": "AAEAEMwA",
    "artist": "Atsuko Nishida",
    "image": "https://raw.githubusercontent.com/chase-manning/pokemon-tcg-pocket-cards/refs/heads/main/images/webp/cards/a2a/006.webp",
    "image_png": "https://raw.githubusercontent.com/chase-manning/pokemon-tcg-pocket-cards/refs/heads/main/images/png/cards/a2a/006.png",
    "flavour_text": "It nimbly dashes about to avoid getting pecked by bird Pokémon that would love to make off with its small, nutrient-rich storage ball.",
    "alternate_versions": [
      {
        "set_code": "a2a",
        "set_name": "Triumphant Light",
        "id": 6,
        "rarity": "◊"
      }
    ]
  },
  {
    "id": "a2a-007",
    "name": "Cherrim",
    "set_code": "a2a",
    "set_name": "Triumphant Light",
    "pack": "Arceus",
    "release_date": "2025-02-28",
    "type": "Pokémon",
    "subtype": "Grass",
    "stage": "Stage 1",
    "evolves_from": "Cherubi",
    "rarity": "◊◊",
    "pack_points": 70,
    "ex": false,
    "mega": false,
    "shiny": false,
    "special_tags": null,
    "art_style": null,
    "health": 80,
    "retreat": 1,
    "weakness": "Fire",
    "ability": {
      "exists": false,
      "name": null,
      "effect": null
    },
    "card_text": null,
    "attacks": {
      "1": {
        "cost": "G",
        "name": "Worry Seed",
        "damage": 40,
        "effect": "Your opponent's Active Pokémon is now Confused."
      },
      "2": {
        "cost": null,
        "name": null,
        "damage": null,
        "effect": null
      }
    },
    "points": 1,